{
  "id": "ep-000",
  "date": "2026-08-22",
  "repo": {
    "full_name": "cavemanlabs/caveman",
    "url": "https://github.com/cavemanlabs/caveman",
    "language": "Python",
    "stars_at_airtime": 4102,
    "velocity_per_hr": 57
  },
  "title": "Caveman: 4,000 stars and a six-line memory",
  "verdict": "MIXED",
  "audio": {
    "url": "/audio/ep-000.mp3",
    "duration_s": 89.25,
    "peaks": [
      0.0,
      0.276,
      0.497,
      0.499,
      0.217,
      0.25,
      0.673,
      0.809,
      0.548,
      0.015,
      0.61,
      0.933,
      0.812,
      0.302,
      0.341,
      0.798,
      0.856,
      0.514,
      0.026,
      0.484,
      0.653,
      0.499,
      0.157,
      0.168,
      0.322,
      0.405,
      0.297,
      0.029,
      0.434,
      0.698,
      0.638,
      0.234,
      0.342,
      0.803,
      0.898,
      0.557,
      0.064,
      0.657,
      0.93,
      0.755,
      0.238,
      0.347,
      0.713,
      0.71,
      0.387,
      0.051,
      0.374,
      0.452,
      0.307,
      0.102,
      0.205,
      0.504,
      0.602,
      0.39,
      0.076,
      0.58,
      0.852,
      0.721,
      0.219,
      0.417,
      0.87,
      0.909,
      0.515,
      0.108,
      0.646,
      0.845,
      0.637,
      0.165,
      0.312,
      0.566,
      0.516,
      0.25,
      0.052,
      0.288,
      0.466,
      0.427,
      0.126,
      0.322,
      0.691,
      0.758,
      0.442,
      0.134,
      0.689,
      0.937,
      0.737,
      0.179,
      0.459,
      0.861,
      0.841,
      0.433,
      0.135,
      0.575,
      0.692,
      0.479,
      0.096,
      0.241,
      0.378,
      0.353,
      0.223,
      0.097,
      0.466,
      0.67,
      0.554,
      0.123,
      0.434,
      0.833,
      0.85,
      0.447,
      0.19,
      0.745,
      0.942,
      0.688,
      0.125,
      0.457,
      0.776,
      0.705,
      0.325,
      0.138,
      0.45,
      0.491,
      0.304,
      0.045,
      0.24,
      0.495,
      0.542,
      0.296,
      0.169,
      0.629,
      0.83,
      0.631,
      0.096,
      0.521,
      0.91,
      0.866,
      0.409,
      0.232,
      0.735,
      0.864,
      0.585,
      0.069,
      0.409,
      0.626,
      0.523,
      0.211,
      0.114,
      0.289,
      0.426,
      0.352,
      0.042,
      0.381,
      0.692,
      0.693,
      0.332,
      0.245,
      0.752,
      0.922,
      0.647,
      0.053,
      0.568,
      0.908,
      0.807,
      0.338,
      0.248,
      0.658,
      0.717,
      0.444,
      0.023,
      0.317,
      0.431,
      0.32,
      0.154,
      0.155,
      0.482,
      0.63,
      0.465,
      0.017,
      0.512,
      0.845,
      0.784,
      0.329,
      0.311,
      0.817,
      0.934,
      0.606,
      0.005,
      0.563,
      0.826,
      0.684,
      0.249,
      0.232,
      0.523,
      0.52,
      0.288,
      0.004,
      0.263,
      0.473,
      0.475,
      0.203,
      0.25,
      0.661,
      0.792,
      0.531,
      0.025,
      0.613,
      0.93,
      0.805,
      0.292,
      0.354,
      0.811,
      0.865,
      0.515,
      0.036,
      0.504,
      0.676,
      0.515,
      0.158,
      0.183,
      0.347,
      0.379,
      0.278,
      0.034,
      0.424,
      0.678,
      0.617,
      0.221,
      0.346,
      0.798,
      0.888,
      0.546,
      0.075,
      0.667,
      0.936,
      0.756,
      0.232,
      0.361,
      0.732,
      0.726,
      0.393,
      0.06,
      0.395
    ]
  },
  "segments": [
    {
      "i": 0,
      "start": 0.0,
      "end": 11.5,
      "text": "It's 11:47 PM in San Francisco, and GitHub's hottest new repo just crossed four thousand stars. This is Repo Radio \u2014 I read the code so you don't have to.",
      "citation": null
    },
    {
      "i": 1,
      "start": 11.85,
      "end": 23.35,
      "text": "Tonight's subject: Caveman. The README promises a full autonomous agent runtime \u2014 memory, tools, scheduling, the works. Four thousand stars in three days. Let's see what's actually in the cave.",
      "citation": null
    },
    {
      "i": 2,
      "start": 23.7,
      "end": 33.3,
      "text": "Crack open core/agent.py and the skeleton is clean: an Agent class, a tool registry, a run loop. Credit where due \u2014 this is readable code.",
      "citation": {
        "file": "core/agent.py",
        "start_line": 12,
        "end_line": 38,
        "code_html": "<pre class=\"shiki\"><code><span class=\"line\" data-line=\"1\">&quot;&quot;&quot;Caveman agent core.\n</span><span class=\"line\" data-line=\"2\">\n</span><span class=\"line\" data-line=\"3\">The Agent owns the think-act loop: it pulls a task, asks the LLM what to\n</span><span class=\"line\" data-line=\"4\">do, dispatches tools, and records the outcome.\n</span><span class=\"line\" data-line=\"5\">&quot;&quot;&quot;\n</span><span class=\"line\" data-line=\"6\">\n</span><span class=\"line\" data-line=\"7\">from dataclasses import dataclass, field\n</span><span class=\"line\" data-line=\"8\">from typing import Any, Callable\n</span><span class=\"line\" data-line=\"9\">\n</span><span class=\"line\" data-line=\"10\">from llm.client import ReasoningEngine\n</span><span class=\"line\" data-line=\"11\">\n</span><span class=\"line cited\" data-line=\"12\">\n</span><span class=\"line cited\" data-line=\"13\">@dataclass\n</span><span class=\"line cited\" data-line=\"14\">class Agent:\n</span><span class=\"line cited\" data-line=\"15\">    &quot;&quot;&quot;A single autonomous agent with a tool registry and a run loop.&quot;&quot;&quot;\n</span><span class=\"line cited\" data-line=\"16\">\n</span><span class=\"line cited\" data-line=\"17\">    name: str\n</span><span class=\"line cited\" data-line=\"18\">    engine: ReasoningEngine\n</span><span class=\"line cited\" data-line=\"19\">    tools: dict[str, Callable[..., Any]] = field(default_factory=dict)\n</span><span class=\"line cited\" data-line=\"20\">    max_steps: int = 25\n</span><span class=\"line cited\" data-line=\"21\">\n</span><span class=\"line cited\" data-line=\"22\">    def register_tool(self, name: str, fn: Callable[..., Any]) -&gt; None:\n</span><span class=\"line cited\" data-line=\"23\">        if name in self.tools:\n</span><span class=\"line cited\" data-line=\"24\">            raise ValueError(f&quot;tool already registered: {name}&quot;)\n</span><span class=\"line cited\" data-line=\"25\">        self.tools[name] = fn\n</span><span class=\"line cited\" data-line=\"26\">\n</span><span class=\"line cited\" data-line=\"27\">    def run(self, goal: str) -&gt; list[dict]:\n</span><span class=\"line cited\" data-line=\"28\">        &quot;&quot;&quot;Run the think-act loop until the engine says done or max_steps.&quot;&quot;&quot;\n</span><span class=\"line cited\" data-line=\"29\">        history: list[dict] = []\n</span><span class=\"line cited\" data-line=\"30\">        for step in range(self.max_steps):\n</span><span class=\"line cited\" data-line=\"31\">            decision = self.engine.decide(goal, history, list(self.tools))\n</span><span class=\"line cited\" data-line=\"32\">            if decision[&quot;action&quot;] == &quot;done&quot;:\n</span><span class=\"line cited\" data-line=\"33\">                break\n</span><span class=\"line cited\" data-line=\"34\">            tool = self.tools[decision[&quot;action&quot;]]\n</span><span class=\"line cited\" data-line=\"35\">            result = tool(**decision.get(&quot;args&quot;, {}))\n</span><span class=\"line cited\" data-line=\"36\">            history.append({&quot;step&quot;: step, &quot;action&quot;: decision[&quot;action&quot;], &quot;result&quot;: result})\n</span><span class=\"line cited\" data-line=\"37\">        return history\n</span><span class=\"line cited\" data-line=\"38\">\n</span><span class=\"line\" data-line=\"39\">    def reset(self) -&gt; None:\n</span><span class=\"line\" data-line=\"40\">        pass\n</span></code></pre>"
      }
    },
    {
      "i": 3,
      "start": 33.65,
      "end": 43.65,
      "text": "But here in llm/client.py? The 'proprietary reasoning engine' is forty lines wrapping someone else's chat API. That's not a reasoning engine, folks. That's a phone call.",
      "citation": {
        "file": "llm/client.py",
        "start_line": 8,
        "end_line": 24,